movieId,tmdbId,overview,poster_path,genres,popularity
718,11687.0,"After a wizard's spell goes awry, 12th-century Gallic knight Godefroy de Papincourt, Count of Montmirail finds himself transported to 1993, along with his dimwitted servant, Jacquouille la Fripouille. Startled and perplexed by modern technology, the duo run amok, destroying cars and causing chaos until they meet Beatrice de Montmirail, an aristocratic descendant of the nobleman, who may be able to help them get back to 1123.",/iBsuPhz0pwWgtOhe4ysqFjwNk3t.jpg,Fantasy|Comedy,5.0381
719,9304.0,"Construction worker Doug Kinney finds that the pressures of his working life, combined with his duties to his wife Laura and daughter Jennifer leaves him with little time for himself. However, he is approached by geneticist Dr. Owen Leeds, who offers Doug a rather unusual solution to his problems: cloning.",/t3CUIrzJwxIS7uS1YDJdfSJuPAo.jpg,Comedy|Fantasy|Science Fiction|Romance,5.8356
720,503475.0,"Anthology of Aardman Animation short films released in theaters in 1996, centered on the new release of the third Wallace & Gromit short, ""A Close Shave.""  Includes: ""A Close Shave,"" ""Creature Comforts"" and ""Heat Electric Commercials"" by Nick Park; ""Rex the Runt: How Dinosaurs Became Extinct"", ""Rex the Runt: Dreams"" and ""Ident"" by Richard Goleszowski; ""Wat's Pig"" and ""My Baby Just Cares For Me"" by Peter Lord; ""Early Bird"" by Peter Lord and David Sproxton; ""Pib and Pog"" directed by Peter Peake",/tWkYclnnChwoMMBFECsEjd5hb77.jpg,Family|Animation|Comedy,0.3242
722,73183.0,"Often called the worst director in the history of cinema, Ed Wood is nevertheless a beloved figure among cult-film aficionados for his oddball productions. This documentary takes a look back at Wood's unique career at the margins of 1950s Hollywood, speaking to those who loved him and hated him. Bela Lugosi Jr. discusses his father's work in the abysmal ""Plan 9 From Outer Space,"" while a Baptist reverend recalls how he was tricked into financing the film.",/gWbwYJIRisTiur9aqMQKSHkiGTB.jpg,Documentary,2.733
723,131232.0,"Two Sicilian friends, Nunzio and Pino, share the same apartment in Turin. Nunzio works in a factory but is laid off because of his illness. Pino, on the other hand, is a mysterious man and he is always traveling because of his work. Nunzio would very much like to know what his friend is doing for a living but Pino will not tell him. Nunzio spends his free time the best he can in his friend's absences. He ends up falling in love with Maria, a commercial employee, whereas his health condition deteriorates...",,Drama,3.944
724,9100.0,"A Catholic school newcomer falls in with a clique of teen witches who wield their powers against all who dare to cross them -- be they teachers, rivals or meddlesome parents.",/8bW2RdRkloYtEPhbQZN4wcdmJP4.jpg,Horror|Drama|Fantasy,3.5056
725,20759.0,"When the champ's promoter, Rev. Sultan, decides something new is needed to boost the marketability of the boxing matches, he searches and finds the only man to ever beat the champ. The problem is that he isn't a boxer anymore and he's white. However, once Rev. Sultan convinces him to fight, he goes into heavy training while the confident champ takes it easy and falls out of shape.",/yEPiu0mC4NqMHOoFLsC6CxQW34d.jpg,Comedy,3.8907
726,46063.0,"Upon taking a new job, young lawyer Rick Hayes is assigned to the clemency case of Cindy Liggett, a woman convicted of first degree murder and sentenced to death. As Hayes investigates the background for her case, the two begin to form a deep friendship, while all the while the date for her execution draws nearer.",/hsMe9TYfPs1VfpZs9xVLZBVGcES.jpg,Drama|Crime,2.4563
727,365371.0,"Seven New Zealand women speak about their lives during World War II: some lost husbands, some got married, some went into service themselves. The director lets the women tell their stories simply, alternating between them talking and archival footage of the war years.",/qak8Mk1flb1dQwnBRAC0RNxFsOt.jpg,Documentary,2.4337
728,32513.0,"In this adaptation of the satirical British novel, Flora Poste, a plucky London society girl orphaned at age 19, finds a new home with some rough relatives, the Starkadders of Cold Comfort Farm. With a take-charge attitude and some encouragement from her mischievous friend, Mary, Flora changes the Starkadders' lives forever when she settles into their rustic estate, bringing the backward clan up to date and finding inspiration for her novel in the process.",/fkPm7MQhn3YqcRDM9qFDKNHiw7D.jpg,Comedy|Romance,2.1872
729,40651.0,"Jakob arrives at the Institute Benjamenta (run by brother and sister Johannes and Lisa Benjamenta) to learn to become a servant. With seven other men, he studies under Lisa: absurd lessons of movement, drawing circles, and servility. He asks for a better room. No other students arrive and none leave for employment. Johannes is unhappy, imperious, and detached from the school's operation. Lisa is beautiful, at first tightly controlled, then on the verge of breakdown. There's a whiff of incest. Jakob is drawn to Lisa, and perhaps she to him. As winter sets in, she becomes catatonic. Things get worse; Johannes notes that all this has happened since Jakob came. Is there any cause and effect?",/sbAYYXZNY6iofJa1EfylnR9MrkC.jpg,Drama,3.293
731,36915.0,"A hardened New Orleans cop, Dave Robicheaux, finally tosses in the badge and settles into life on the bayou with his wife. But a bizarre plane crash draws him back into the fray when his family is viciously threatened.",/yUWVNHA3dVc1CmxNIcXZWqbqWc8.jpg,Drama|Mystery|Thriller,0.7934
732,40507.0,"The Rebels rule the streets of Gary, Indiana. They shoot storekeeper Marvin Bookman for giving the police information about a drive-by shooting they committed. Marvin’s son, former NFL star and Rebel founder John returns to be with his father and, with a little help from some friends, to destroy the gang his way.",/uirrsTZmoPmscHZdyWz4tiXVqHE.jpg,Action|Drama|Crime|Thriller,2.6352
733,9802.0,"When vengeful General Francis X. Hummel seizes control of Alcatraz Island and threatens to launch missiles loaded with deadly chemical weapons into San Francisco, only a young FBI chemical weapons expert and notorious Federal prisoner have the skills to penetrate the impregnable island fortress and take him down.",/j5mxLNWjUlXUUk8weFBtnF4afIR.jpg,Action|Adventure|Thriller,6.0893
734,25697.0,"When the very moralistic college ethics instructor Jack Lambert finds himself living next door to an accused German death camp commander, he takes it upon himself to rid the world of this man.",/zL9RbLQrhTyi60ZeXjc8hEIaTxf.jpg,Comedy,2.5376
735,21588.0,"Cemetery watchman, Francesco Dellamorte, is tasked with dispatching the recently deceased when they rise from their graves.",/cI5AV3jCuxmoQp0N7Z16SI2b7Xk.jpg,Comedy|Horror,3.9913
736,664.0,"An unprecedented series of violent tornadoes is sweeping across Oklahoma. Tornado chasers, headed by Dr. Jo Harding, attempt to release a groundbreaking device that will allow them to track them and create a more advanced warning system. They are joined by Jo's soon to be ex-husband Bill, a former tornado chaser himself, and his girlfriend Melissa.",/d4ie3f6QTvNw40V770Uzo87SDZn.jpg,Action|Adventure|Drama,4.8212
737,11867.0,"A sexy nightclub owner, Barb Wire moonlights as a mercenary in Steel Harbor, one of the last free zones in the now fascist United States. When scientist Cora Devonshire wanders into Barb's establishment, she gets roped into a top-secret government plot involving biological weapons. Soon Barb is reunited with her old flame Axel Hood, who is now Cora's husband and a guerrilla fighter, resulting in plenty of tense action.",/jW5TLptY7PL1Mllq1g1uMjwXLXT.jpg,Science Fiction|Action|Adventure,1.6699
738,47119.0,A self-centered man (Gérard Depardieu) with many diversions occasionally visits his 4-year-old son (Antoine Pialat) and the boy's mother (Géraldine Pailhas).,/5JUEy8sDkzKp0Ok2G5KW2TCqYF4.jpg,Drama,2.3393
739,314352.0,"Christine and her friend Linda live together and get on very well - except when it comes to men. While Christine is still mourning her ex-boyfriend, Linda takes things like sex and relationships rather casually. Barbara, the third in the group, is completely different: she has been in steady hands for seven years and still believes in the one great love.",/mIhqYGCfc2rIyJMQRDYdecQC1S8.jpg,Comedy,3.1912
741,9323.0,"In the year 2029, the barriers of our world have been broken down by the net and by cybernetics, but this brings new vulnerability to humans in the form of brain-hacking. When a highly-wanted hacker known as 'The Puppetmaster' begins involving them in politics, Section 9, a group of cybernetically enhanced cops, are called in to investigate and stop the Puppetmaster.",/9gC88zYUBARRSThcG93MvW14sqx.jpg,Action|Animation|Science Fiction,7.2709
742,10280.0,"An obese lawyer finds himself growing ""Thinner"" when an old Romani man places a hex on him. Now the lawyer must call upon his friends in organized crime to help him persuade the old man to lift the curse. Time is running out for the desperate lawyer as he draws closer to his own death, and grows ever thinner.",/nXqHqsQXA0jJpCaUsyre1Yw18oV.jpg,Fantasy|Horror,5.6064
743,10535.0,"The evil Gen. Rancor has his sights set on world domination, and only one man can stop him: Dick Steele, also known as Agent WD-40. Rancor needs to obtain a computer circuit for the missile that he is planning to fire, so Steele teams up with Veronique Ukrinsky, a KGB agent whose father designed the chip. Together they try to locate the evil mastermind's headquarters, where Veronique's father and several other hostages are being held.",/yoegp9XEG4YCbJJKR0wvm0BGYpG.jpg,Comedy|Action,4.3393
744,124613.0,"Amir is an illegal Pakistani immigrant smuggled into England in the 1960's to work, to send money to his family and perhaps even bring them over with him. A skilled laborer, he is forced to do unskilled work like shoveling sheep dung and processing wool. He lives in a boarding house with nearly a dozen other men, under the supervision of Hussein Shah. He befriends a young student, Sakib, who dreams of being a writer. Their existence is punctuated by secret movies, a visiting prostitute, fear of detection and deportation, and the gangster-like smuggler who comes by for his take every week. The household is shaken up by the arrival of a white girl, Shah's girlfriend, and the sense of femininity and family she brings.",/hzPSO1tehGTkqtJjc79ONicQnfJ.jpg,Comedy|Drama,3.3099
745,532.0,"Wallace's whirlwind romance with the proprietor of the local wool shop puts his head in a spin, and Gromit is framed for sheep-rustling in a fiendish criminal plot.",/qdIR27trLyrlJ5nmkbcG3Bomah6.jpg,Family|Animation|Comedy,2.5345
746,26744.0,"Lawyer Joe Morse wants to consolidate all the small-time numbers racket operators into one big powerful operation. But his elder brother Leo is one of these small-time operators who wants to stay that way, preferring not to deal with the gangsters who dominate the big-time.",/x33LVKf4yWdjMeczJkzE5sIw4VG.jpg,Crime|Drama,2.9556
747,16299.0,"An incredibly dull-witted family unknowingly stumble upon an illegal weapons deal while on the trail of their ""stolen"" garbage.",/uR0EPkE66y2DU21NOZAu6xtfpQL.jpg,Comedy|Family,5.5131
748,10547.0,"Zane Ziminski is an astrophysicist who receives a message that seems to have extraterrestrial origins. Eerily soon after his discovery, Zane is fired. He then embarks on a search to determine the origins of the transmission that leads him into a Hitchcockian labyrinth of paranoia and intrigue.",/3051CM0SZfZJ3oOJG8P0YERQl1w.jpg,Science Fiction|Thriller|Horror,3.8276
749,245268.0,An Australian blowhard raises two orphaned children as his own in the years leading up to WWII.,/vkduflNPvXr2NegyqV3OhOtxrnr.jpg,Action|Comedy|Drama|War,2.9797
750,935.0,"After the insane General Jack D. Ripper initiates a nuclear strike on the Soviet Union, a war room full of politicians, generals and a Russian diplomat all frantically try to stop it.",/7SixLzxcqezkZEYU8pcHZgbkmjp.jpg,Comedy|War,3.7334
751,55613.0,The mountain-village passions of a German widow and her sons unfold in the style of a 1920s expressionist movie.,/qolQ7M5hpbBwcvpMpfeSMyU64rs.jpg,Comedy|Drama|Fantasy,5.8448
752,215107.0,"Vermont is for Lovers is an independently produced docudrama released in 1992, starring George Thrush and Marya Cohn and shot on location Tunbridge, Vermont. The film concerns a couple visiting Vermont in order to be married, and interviewing local residents on the subject of marriage. Largely improvised and using non-professional actors, the film was shown at various film festivals including the Melbourne International Film Festival and the Hawaii International Film Festival. The movie was not very well-received by the national press, with the New York Times calling it, “vaguely amiable.” While the Washington Post review commented that the film was an “all-too-easy target for ridicule,” it also mentioned one of the film’s high points: “In one scene, a typically droll Vermont resident (playing himself) sums up his state’s fabled coolness to strangers by suggesting that a sign be placed at the state line, reading ‘Welcome to Vermont. Now Leave.’”",/dBiufr6Xow23YvQjSRGgd0xAvu5.jpg,Comedy|Documentary,0.0503
753,41007.0,"For 16 years Miss Bentley has been spending April at an elegant hillside villa on Lake Como. This year, 1937, her London society artist father has recently died and the only other English-speaking guests are brash Americans. Then Major Wilshaw arrives. He suggests they meet for cocktails and Miss Bentley stands him up -- not even thinking about it -- as she helps the new nanny of an Italian family settle in. Miss Beaumont, a tall, young American who has dropped out of finishing school in Switzerland, is bored and finds some amusement in flirting with the major, whose libido is awakened for the first time since before the great war. And Miss Bentley now finds more about the major to admire than his ears.",/cgoiGvNffe4tZC33x6RIQQiKIp9.jpg,Comedy|Drama|Romance,0.4374
754,35645.0,"Two teen girls, one from the city, one from the country, try to find the hidden gold of Bear Mountain learning about friendship, loyalty and courage on the way.",/6USWKkOjS40KY19Q0gPEelEiDhc.jpg,Drama|Adventure|Family|Mystery,3.1779
755,110465.0,"During the British Raj, the orphan of a British soldier poses as a Hindu and is torn between his loyalty to a Buddhist mystic and aiding the English secret service.",/naUTqET84gVJcn0e1AnA3eL05t1.jpg,Adventure|Drama|Family,2.9165
756,255546.0,"A biography of the Portuguese-born Brazilian singer Carmen Miranda, whose most distinctive feature was her tutti-frutti hat. From her arrival in the US as the ""Brazilian Bombshell"" to her Broadway career and Hollywood stardom in the 1940s.",/aYYFx5SDQmhTwZnYxSA3r5xlAir.jpg,Documentary,3.8251
757,40751.0,"Ouyang Feng is a heartbroken and cynical man who spends his days in the desert, connecting expert swordsmen with those seeking revenge and willing to pay for it. Throughout five seasons in exile, Ouyang spins tales of his clients' unrequited loves and unusual acts of bravery.",/ciyEwAbvoMHPP3281cgSnfslu43.jpg,Drama|Action,1.7735
758,275096.0,"In the yard of an Iranian village school stands in the shade of a tree a large stoneware jar from which all the pupils drink fresh water. On an unfortunate day, the jar starts leaking. The schoolmaster tries hard to get a new one but in vain. The only solution is to have it fixed...",/rupg2QX2BAVlwbD6zMWxZa3kIO5.jpg,,0.1213
759,85778.0,A film about the work of the artist most famous for her monuments such as the Vietnam Memorial Wall and the Civil Rights Fountain Memorial.,/fqYvHdWNV84yF7zPV3ENHOZ2Jow.jpg,Documentary,0.0777
760,11101.0,"A German Platoon is explored through the brutal fighting of the Battle of Stalingrad. After half of their number is wiped out and they're placed under the command of a sadistic captain, the platoon lieutenant leads his men to desert. The platoon members attempt escape from the city, now surrounded by the Soviet Army.",/rB78VDAOK94KJWp9ofgE3GSQEor.jpg,Drama|History|War,7.9242
761,9826.0,The 21st successor to the role of Bengalla's resident superhero must travel to New York to prevent a rich madman from obtaining three magic skulls that would give him the secret to ultimate power.,/8k8RSMkmGR9Lp6FbKtithM3KIQb.jpg,Adventure|Action,1.3952
762,9879.0,"Bounced from her job, Erin Grant needs money if she's to have any chance of winning back custody of her child. But, eventually, she must confront the naked truth: to take on the system, she'll have to take it all off. Erin strips to conquer, but she faces unintended circumstances when a hound dog of a Congressman zeroes in on her and sharpens the shady tools at his fingertips, including blackmail and murder.",/4zMy6R7acotCmGoDk4sjzRtDwKn.jpg,Comedy|Crime|Drama,6.6922
763,63564.0,"It is 1977, Dublin rocks to the music of Thin Lizzy and the world is stunned by the death of Elvis Presley. Frankie, caught between acne and adulthood, has just completed his final exams in school. Convinced he will fail, he survives the summer organising a beach party, having lustful thoughts about two girls he believes are unobtainable and fending off the advances from a visiting American family friend, all whilst coping with his oddball family.",/pSdzsYKg1wpmYpflD1ZEq5Cf9rd.jpg,Drama|Comedy,2.0595
764,22621.0,"Victor is a cook who works in a greasy roadside restaurant owned by his mother, Dolly. It's just the two of them, a waitress named Delores, and a heavy drinking regular, Leo. But things change when Callie, a beautiful college dropout, shows up as a new waitress and steals Victor's heart. But Victor is too shy to do anything about it, and too self-consciously overweight to dream of winning Callie away.",/xo2KsY7hOHDqpgYlDStL56zmgaq.jpg,Drama|Romance,3.1373
765,7095.0,"Born with a rare condition that makes him age four times faster than normal, ten-year-old Jack Powell looks like a forty-year-old man. After years of homeschooling, he enters public school for the first time, eager to make friends and live like any other kid—only to discover that growing up too fast means learning some of life’s hardest lessons early.",/9W6UI8UQ4YdLCAaPFd0lcKJ1tX4.jpg,Comedy|Family|Drama,4.6575
766,26890.0,"Based on the true story of Valerie Solanas who was a 1960s radical preaching hatred toward men in her ""Scum"" manifesto. She wrote a screenplay for a film that she wanted Andy Warhol to produce, but he continued to ignore her. So she shot him. This is Valerie's story.",/eF4iTAjunicLQyc6AdF7JNwSBOC.jpg,Drama,0.6072
767,46732.0,"Based on the novel by Truman Capote, this often-witty coming-of-age drama looks at a young man growing up with an unusual family in the Deep South in the 1940s. Becoming an orphan in 1935, Collin moves to his dad's cousins Verena and Dolly. Verena is a rich, bossy businesswoman. Dolly, Collin and the maid revolt, moving to a tree house.",/pcdi92LC26RW3zm97SwF3NXYTUr.jpg,Comedy|Drama|Family,3.6669
768,124633.0,"This tale takes place in a bar. The Spanish Alonso and his blind mother run this place. Bay, who is Alonso's friend live here too. This story tells something about Alonso and Bay and the ""American Dream"".",/xtJfxmlIe3iRFFTP4TNFRwacVz.jpg,Drama,5.3824
769,581579.0,"Following the life of Marlene Dietrich through her films (including home movies) and interviews with family, friends, co-workers, acquaintances, and presumed lovers. From the cabaret scene in 1920's Berlin, silent films in Germany, her triumph in _The Blue Angel_ in 1930 (for which her screen test is included in this film), to Hollywood with Josef von Sternberg. The highest paid female star of her time, the luster dimmed by 1935. and in the later part of the decade she might be the most valuable actress in the world but also the most unemployable. But with _Destry Rides Again_ Marlene became a sex symbol who could play comedy and the most remarkable comeback in Hollywood was a reality. She was one of the most active entertainers of the allied troops during WW II. After the war movies were infrequent, but a new career on the stage continued for another 20 years, until she retired into seclusion for the last decade of her life.",/faHxYNlQ7RGDtqmaNBpFf0HKozg.jpg,Documentary,0.314
771,202425.0,A young man with dreams of pursuing a career in music moves form his small village to  the capital. Along the way he falls head over heels for a woman - the same woman his boss is also pursuing for his own reasons.,/aWU6bdzk1vqmGhMTKixafxIEeBW.jpg,Music|Romance,0.1176
772,196940.0,"The boisterous and cheerful lives of the residents of Cameroon are barely dented by incursions of supernatural power in this humor-filled rendition of traditional folk tales in modern guise. In the story, a cheerfully naughty girl crosses paths with a witch who has the power to satisfy her curiosity about men by changing her into a young man. She then becomes one of the boy suitors for the amorous attentions of a policeman's daughter. Some of the men have unusual names and even odder magical gifts: one of them has the ability to make a man's genitals disappear when he shakes hands with him.",/399VYKyl8sBpz3MEDunsyfgAl1z.jpg,Comedy,0.161
773,77771.0,"Mory, a cowherd, and Anta, a university student, try to make money in order to go to Paris and leave their boring past behind.",/kcBYKHyg9GcQqa6DWq0AuQDhtPI.jpg,Drama|Romance,2.269
774,181083.0,"In pre-colonial times a peddler crossing the savanna discovers a child lying unconscious in the bush. When the boy comes to, he is mute and cannot explain who he is. The peddler leaves him with a family in the nearest village. After a search for his parents, the family adopts him, giving him the name Wend Kuuni (God's Gift) and a loving sister with whom he bonds. Wend Kuuni regains his speech only after witnessing a tragic event that prompts him to reveal his own painful history.",/7t0xjFUqy4T9gcM9lKYle8tTIq3.jpg,Drama,1.2544
775,41225.0,"Anthology film from three European directors based on stories by Edgar Allan Poe: a cruel countess haunted by a ghostly horse, a sadistic young man haunted by his double, and an alcoholic actor haunted by the Devil.",/9HmCwfPG7URPSXSrmEAFN65VoWE.jpg,Horror|Mystery|Drama,4.0995
776,188589.0,"Gena is an average woman who is torn between her current boyfriend's desire to marry her and start a family, and the unexpected arrival of an old boyfriend wanting to pick up where they left off. To further complicate matters, she might be pregnant herself. In the mist of this unsettled personal life, Gena leaves her two men to attend a baby shower party for a girl friend and talks with the various female attendees all of whom are facing their own ticking biological clocks.",/fFazehXwOoYhHITyNCi5GDRrWQa.jpg,Romance|Comedy|Drama,1.339
777,87190.0,"Union soldiers in search of food descend on the farm of a Confederate family and decide to stay until one in their ranks' wounds have healed. While the war weary Union captain falls for the mother of the family - whose husband is off fighting for the rebels - her son plots revenge on the dirty, double-dealing Yankees.",/yhzCZwkiFYrOrvmMlz14HnV0cM5.jpg,Western|Drama|War|History,1.3369
778,627.0,"Heroin addict Mark Renton stumbles through bad ideas and sobriety attempts with his unreliable friends --Sick Boy, Begbie, Spud and Tommy. He also has an underage girlfriend, Diane, along for the ride. After cleaning up and moving from Edinburgh to London, Mark finds he can't escape the life he left behind as Begbie and Sick Boy come knocking.",/1jUC02qsqS2NxBMFarbIhcQtazV.jpg,Drama|Crime,4.9743
779,32872.0,"Two strangers, whose paths are always crossing, finally meet when fate steps in. It took them twenty years to fall in love at first sight.",/ndbW89bKquf5gMXgncY2fCkrIa.jpg,Comedy|Romance,3.6671
780,602.0,"Strange phenomena surface around the globe. The skies ignite. Terror races through the world's major cities. As these extraordinary events unfold, it becomes increasingly clear that a force of incredible magnitude has arrived. Its mission: total annihilation over the Fourth of July weekend. The last hope to stop the destruction is an unlikely group of people united by fate and unimaginable circumstances.",/p0BPQGSPoSa8Ml0DAf2mB2kCU0R.jpg,Action|Adventure|Science Fiction,7.2909
781,14553.0,"Lucy Harmon, an American teenager is arriving in the lush Tuscan countryside to be sculpted by a family friend who lives in a beautiful villa. Lucy visited there four years earlier and exchanged a kiss with an Italian boy with whom she hopes to become reacquainted.",/5ugxnyVmBK952bwOcE4M0szNimx.jpg,Drama|Romance,7.7357
782,9566.0,"When the San Francisco Giants pay center-fielder, Bobby Rayburn $40 million to lead their team to the World Series, no one is happier or more supportive than #1 fan, Gil Renard.  When Rayburn becomes mired in the worst slump of his career, the obsessed Renard decides to stop at nothing to help his idol regain his former glory—not even murder.",/lu7CjP8YES5dJMCFg5O9o9jCkjl.jpg,Thriller|Action|Drama,5.099
783,10545.0,"Isolated bell-ringer Quasimodo wishes to leave Notre Dame tower against the wishes of Judge Claude Frollo, his stern guardian and Paris' strait-laced Minister of Justice. His first venture to the outside world finds him Esmeralda, a kind-hearted and fearless Romani woman who openly stands up to Frollo's tyranny.",/7k0fr2xLCTChjN8MnGNThTP9uEB.jpg,Drama|Animation|Family,9.5448
