movieId,tmdbId,overview,poster_path,genres,popularity
1,862.0,"Led by Woody, Andy's toys live happily in his room until Andy's birthday brings Buzz Lightyear onto the scene. Afraid of losing his place in Andy's heart, Woody plots against Buzz. But when circumstances separate Buzz and Woody from their owner, the duo eventually learns to put aside their differences.",/uXDfjJbdP4ijW5hWSBrPrlKpxab.jpg,Family|Comedy|Animation|Adventure,18.3998
2,8844.0,"When siblings Judy and Peter discover an enchanted board game that opens the door to a magical world, they unwittingly invite Alan -- an adult who's been trapped inside the game for 26 years -- into their living room. Alan's only hope for freedom is to finish the game, which proves risky as all three find themselves running from giant rhinoceroses, evil monkeys and other terrifying creatures.",/iWV47r6kFneCiApgrMII5HSkfHw.jpg,Adventure|Fantasy|Family,2.714
3,15602.0,"A family wedding reignites the ancient feud between next-door neighbors and fishing buddies John and Max. Meanwhile, a sultry Italian divorcée opens a restaurant at the local bait shop, alarming the locals who worry she'll scare the fish away. But she's less interested in seafood than she is in cooking up a hot time with Max.",/1FSXpj5e8l4KH6nVFO5SPUeraOt.jpg,Romance|Comedy,2.489
4,31357.0,"Cheated on, mistreated and stepped on, the women are holding their breath, waiting for the elusive ""good man"" to break a string of less-than-stellar lovers. Friends and confidants Vannah, Bernie, Glo and Robin talk it all out, determined to find a better way to breathe.",/qJU6rfil5xLVb5HpJsmmfeSK254.jpg,Comedy|Drama|Romance,5.0564
5,11862.0,"Just when George Banks has recovered from his daughter's wedding, he receives the news that she's pregnant ... and that George's wife is expecting too. He was planning on selling their home, but that's a plan that—like George—will have to change with the arrival of both a grandchild and a kid of his own.",/rj4LBtwQ0uGrpBnCELr716Qo3mw.jpg,Comedy|Family,4.9003
6,949.0,Obsessive master thief Neil McCauley leads a top-notch crew on various daring heists throughout Los Angeles while determined detective Vincent Hanna pursues him without rest. Each man recognizes and respects the ability and the dedication of the other even though they are aware their cat-and-mouse game may end in violence.,/umSVjVdbVwtx5ryCA2QXL44Durm.jpg,Crime|Drama|Action,11.3725
7,11860.0,"Sabrina Fairchild, a chauffeur's daughter, grew up at the Long Island estate of the wealthy Larrabee family enchanted with their sparkling world of privilege and wealth, but she's especially enamored of younger son David, a charming playboy. After the once plain Sabrina returns from a sojourn in Paris transformed into a glamorous young woman, she at long last catches David's eye. In a calculated effort to manipulate David away from her and into a more financially advantageous marriage, formidable older brother Linus devises a plan to keep them apart.",/i8PbLJDPU7vCwwscWD625oHbJy.jpg,Romance|Drama|Comedy,5.8952
8,45325.0,"A mischievous young boy, Tom Sawyer, witnesses a murder by the deadly Injun Joe. Tom becomes friends with Huckleberry Finn, a boy with no future and no family. Tom has to choose between honoring a friendship or honoring an oath because the town alcoholic is accused of the murder. Tom and Huck go through several adventures trying to retrieve evidence.",/bMY31ikEOIPOHqQwhPhII8UVBln.jpg,Family|Action|Adventure|Drama,2.7151
9,9091.0,When a man's daughter is suddenly taken during a championship hockey game – with the captors demanding a billion dollars by game's end – he frantically sets a plan in motion to rescue her and abort an impending explosion before the final buzzer.,/1pylO6YX5XdOA6QCc5IRxrrffkg.jpg,Action|Drama|Thriller|Crime,1.6623
10,710.0,"When a powerful satellite system falls into the hands of Alec Trevelyan, AKA Agent 006, a former ally-turned-enemy, only James Bond can save the world from a dangerous space weapon that -- in one short pulse -- could destroy the earth! As Bond squares off against his former compatriot, he also battles Xenia Onatopp, an assassin who uses pleasure as her ultimate weapon.",/z0ljRnNxIO7CRBhLEO0DvLgAFPR.jpg,Adventure|Action|Thriller,5.2319
11,9087.0,"Widowed U.S. president Andrew Shepherd, one of the world's most powerful men, can have anything he wants -- and what he covets most is Sydney Ellen Wade, a Washington lobbyist. But Shepherd's attempts at courting her spark wild rumors and decimate his approval ratings.",/yObOAYFIHXHkFPQ3jhgkN2ezaD.jpg,Comedy|Drama|Romance,4.725
12,12110.0,"When a lawyer shows up at the vampire's doorstep, he falls prey to his charms and joins him in his search for fresh blood. Enter Professor Van Helsing, who may be the only one able to vanquish the Count.",/4rRfZz8YnHNRr16t3CFcJrPdXHi.jpg,Comedy|Horror,4.3472
13,21032.0,"An outcast half-wolf risks his life to prevent a deadly epidemic from ravaging Nome, Alaska.",/dCVcdb5oxDizqFLz0F7TE60NoC9.jpg,Family|Animation|Adventure,2.4464
14,10858.0,A look at President Richard M. Nixon—a man carrying the fate of the world on his shoulders while battling the self-destructive demands from within—spanning his troubled boyhood in California to the shocking Watergate scandal that would end his Presidency.,/cz2MTGr2wpDZLirgV2rGHBdA2t3.jpg,Drama|History,2.5431
15,1408.0,"Morgan Adams and her slave, William Shaw, are on a quest to recover the three portions of a treasure map. Unfortunately, the final portion is held by her murderous uncle, Dawg. Her crew is skeptical of her leadership abilities, so she must complete her quest before they mutiny against her. This is made yet more difficult by the efforts of the British crown to end her pirate raids.",/hYdeBZ4BFXivdouxLfQGWNE6zRx.jpg,Action|Adventure,4.519
16,524.0,"In Las Vegas, two best friends--a casino executive and a Mafia enforcer--compete for a gambling empire and a fast-living, fast-loving socialite.",/gziIkUSnYuj9ChCi8qOu2ZunpSC.jpg,Crime|Drama,8.6626
17,4584.0,"The Dashwood sisters, sensible Elinor and passionate Marianne, whose chances at marriage seem doomed by their family's sudden loss of fortune.  When Henry Dashwood dies unexpectedly, his estate must pass on by law to his son from his first marriage, John and wife Fanny. But these circumstances leave Mr. Dashwood's current wife, and daughters Elinor, Marianne and Margaret, without a home and with barely enough money to live on. As Elinor and Marianne struggle to find romantic fulfillment in a society obsessed with financial and social status, they must learn to mix sense with sensibility in their dealings with both money and men.",/cBK2yL3HqhFvIVd7lLtazWlRZPR.jpg,Drama|Romance,10.8665
18,5.0,It's Ted the Bellhop's first night on the job...and the hotel's very unusual guests are about to place him in some outrageous predicaments. It seems that this evening's room service is serving up one unbelievable happening after another.,/75aHn1NOYXh4M7L5shoeQ6NGykP.jpg,Comedy,3.046
19,9273.0,"Summoned from an ashram in Tibet, Ace finds himself on a perilous journey into the jungles of Africa to find Shikaka, the missing sacred animal of the friendly Wachati tribe. He must accomplish this before the wedding of the Wachati's Princess to the prince of the warrior Wachootoos. If Ace fails, the result will be a vicious tribal war.",/wcinCf1ov2D6M3P7BBZkzQFOiIb.jpg,Crime|Comedy|Adventure,4.8322
20,11517.0,"When a vengeful New York transit cop decides to steal a trainload of subway fares, his foster brother—a fellow cop—tries to protect him.",/jWBDz6Mf9aQVBiUS76JQsEhvoJl.jpg,Action|Comedy|Crime,3.8018
21,8012.0,"Chili Palmer is a Miami mobster who gets sent to L.A. to collect a bad debt from Harry Zimm, a Hollywood producer who specializes in cheesy horror films. When Chili meets Harry's leading lady, the romantic sparks fly. After pitching his own life story as a movie idea, Chili learns that being a mobster and being a Hollywood producer really aren't all that different.",/r82SdPhg4fnIcLt0ogIjQxqjdcO.jpg,Comedy|Thriller|Crime,3.9762
22,1710.0,An agoraphobic psychologist and a female detective must work together to take down a serial killer who copies serial killers from the past.,/oMgwJb016znNZcpDR20eXxZoW8A.jpg,Thriller|Crime|Mystery,5.8604
23,9691.0,"Assassin Robert Rath arrives at a funeral to kill a prominent mobster, only to witness a rival hired gun complete the job for him -- with grisly results. Horrified by the murder of innocent bystanders, Rath decides to take one last job and then return to civilian life. But finding his way out of the world of contract killing grows ever more dangerous as Rath falls for his female target and becomes a marked man himself.",/wPmZYnaQpxwoHmwNwVhZ2IY0UbF.jpg,Action|Adventure|Crime|Thriller,3.8563
24,12665.0,"Harassed by classmates who won't accept his shocking appearance, a shy young man known as ""Powder"" struggles to fit in. But the cruel taunts stop when Powder displays a mysterious power that allows him to do incredible things. This phenomenon changes the lives of all those around him in ways they never could have imagined.",/aQSA63T7zyzZxBZxr2MQaxt1gtO.jpg,Drama|Fantasy,4.9515
25,451.0,"Ben Sanderson, an alcoholic Hollywood screenwriter who lost everything because of his drinking, arrives in Las Vegas to drink himself to death. There, he meets and forms an uneasy friendship and non-interference pact with prostitute Sera.",/wTrFpGe3U65kXTldIUxuM2hmOAK.jpg,Drama|Romance,2.8832
26,16420.0,The evil Iago pretends to be friend of Othello in order to manipulate him to serve his own end in the film version of this Shakespeare classic.,/kyevuYzW36wKadiE8lftLac5VwQ.jpg,Drama,3.6739
27,9263.0,"Waxing nostalgic about the bittersweet passage from childhood to puberty, four childhood girlfriends — Teeny, Chrissy, Samantha and Roberta — recall the magical summer of 1970. During their walk down memory lane, they reconcile experiences with boys, secrets, bullies and more.",/q31Ks8oAmM4Nq2CcGjyYYpdBAmh.jpg,Comedy|Drama|Romance,2.019
28,17015.0,"Living with her snobby family on the brink of bankruptcy, Anne Elliot is an unconforming woman with modern sensibilities. When Frederick Wentworth – the dashing one she once sent away – crashes back into her life, Anne must choose between putting the past behind her or listening to her heart when it comes to second chances.",/10hycdhFLq3M3y0ONxIMSiY8Mrs.jpg,Drama|Romance,5.5688
29,902.0,"A scientist in a surrealist society kidnaps children to steal their dreams, hoping that they slow his aging process.",/whwT3Q9JxbAYzEc3t7uYYcCbTMf.jpg,Fantasy|Science Fiction|Adventure,2.674
30,37557.0,"Shanghai, China, 1930. When young Shuisheng arrives from the countryside, his uncle Liushu puts him at the service of Bijou, the mistress of Laoda, supreme boss of the Tang Triad, constantly threatened by his enemies, both those he knows and those lurking in the shadows.",/tzG1UxUSfPACREjgBrsPDRUvneH.jpg,Drama|Crime,2.1228
31,9909.0,"Former Marine Louanne Johnson lands a gig teaching in a pilot program for bright but underachieving teens at a notorious inner-city high school. After having a terrible first day, she decides she must throw decorum to the wind. When Johnson returns to the classroom, she does so armed with a no-nonsense attitude informed by her military training and a fearless determination to better the lives of her students -- no matter what the cost.",/yWHWC8fJRp2kLgiFrEa8o3krOH9.jpg,Drama,5.5843
32,63.0,"In the year 2035, convict James Cole reluctantly volunteers to be sent back in time to discover the origin of a deadly virus that wiped out nearly all of the earth's population and forced the survivors into underground communities. But when Cole is mistakenly sent to 1990 instead of 1996, he's arrested and locked up in a mental hospital. There he meets psychiatrist Dr. Kathryn Railly and the son of a famous virus expert who may hold the key to the Army of the 12 Monkeys; thought to be responsible for unleashing the killer disease.",/gt3iyguaCIw8DpQZI1LIN5TohM2.jpg,Science Fiction|Thriller|Mystery,5.4242
33,78802.0,"In 1930 South America, a small group of French pilots struggle to prove they can offer a reliable airmail service over the Andes. When one of the young pilots crashes on such a flight, he has to try and get back to civilization on foot. Back home, his wife and colleagues start to fear the worst.",/zoxqNb6v55C35DDqNn03Grzhzgr.jpg,Romance|Adventure,2.9384
34,9598.0,"Babe is a little pig who doesn't quite know his place in the world. With a bunch of odd friends, like Ferdinand the duck who thinks he is a rooster and Fly the dog he calls mum, Babe realises that he has the makings to become the greatest sheep pig of all time, and Farmer Hoggett knows it. With the help of the sheep dogs, Babe learns that a pig can be anything that he wants to be.",/zKuQMtnbVTz9DsOnOJmlW71v4qH.jpg,Fantasy|Drama|Comedy|Family,5.5202
35,47018.0,"Painter Dora Carrington develops an intimate but extremely complex bond with writer Lytton Strachey. Though Lytton is a homosexual, he is enchanted by the mysterious Dora and they begin a lifelong friendship that has strangely romantic undertones. Eventually, Lytton and Dora decide to live together, despite the fact that the latter has fallen in love with military man Ralph Partridge, whom she plans to marry.",/8NmeBTkC4UQa8XT2GGsBN2R8Bqo.jpg,History|Drama|Romance,4.7866
36,687.0,A death row inmate turns for spiritual guidance to a local nun in the days leading up to his scheduled execution for the murders of a young couple.,/eShxyjhWoFl3BwsuEmVsr4nLaMZ.jpg,Drama,7.1295
37,139405.0,"A young Russian boy, Thomas Minton, travels to New York as a passenger on a Russian freighter. Close to Ellis Island he gets off and thus starts his journey to America the same way as all immigrants in former times. Thomas is searching for the family of one of his ancestors, who had emigrated decades ago, but once sent a letter home together with a sample of his new profession: 3D-Photography.",/iP0bT4f4BTAZ6fWKgLmd4lNeJ2H.jpg,Adventure|History|Drama|Family,0.2429
38,33689.0,"Identical 9-year-olds from very different backgrounds: orphaned Amanda and wealthy Alyssa meet at summer camp and decide to switch places -- and play matchmaker between Alyssa's dad, Roger, and the kind social worker who cares for Amanda.",/4CptjFLiIJXtjc3dykS7vkEHMbw.jpg,Comedy|Family|Romance,5.3129
39,9603.0,"Shallow, rich and socially successful Cher is at the top of her Beverly Hills high school's pecking scale. Seeing herself as a matchmaker, Cher first coaxes two teachers into dating each other. Emboldened by her success, she decides to give hopelessly klutzy new student Tai a makeover. When Tai becomes more popular than she is, Cher realizes that her disapproving ex-stepbrother was right about how misguided she was -- and falls for him.",/8AwVTcgpTnmeOs4TdTWqcFDXEsA.jpg,Comedy|Romance,6.2456
40,34615.0,A South-African preacher goes to search for his wayward son who has committed a crime in the big city.,/96TZr6o4kuiIEryC5jkzaQoP6m5.jpg,Drama,2.0491
41,31174.0,"A murderous lust for the British throne sees Richard III descend into madness. Though the setting is transposed to the 1930s, England is torn by civil war, split between the rivaling houses of York and Lancaster. Richard aspires to a fascist dictatorship, but must first remove the obstacles to his ascension—among them his brother, his nephews and his brother's wife. When the Duke of Buckingham deserts him, Richard's plans are compromised.",/aN2BcIH6rvGbYiRQCS8lxOdeeVQ.jpg,Drama|War,5.3852
42,11443.0,On the streets they call cash dead presidents. And that's just what a Vietnam veteran is after when he returns home from the war only to find himself drawn into a life of crime. With the aid of his fellow vets he plans the ultimate heist -- a daring robbery of an armored car filled with unmarked U.S. currency!,/wRLepMZoUCwjLFb1WSbuUT6uVWR.jpg,Action|Crime|Drama|Thriller|War,1.515
43,35196.0,"An aspiring young physician, Robert Merivel found himself in the service of King Charles II and saves the life of someone close to the King. Merivel joins the King's court and lives the high life provided to someone of his position. Merivel is ordered to marry his King's mistress in order to divert the queens suspicions. He is given one order by the king and that is not to fall in love. The situation worsens when Merivel finds himself in love with his new wife. Eventually, the King finds out and relieves Merivel of his position and wealth. His fall from grace leaves Merivel where he first started. And through his travels and reunions with an old friend, he rediscovers his love for true medicine and what it really means to be a physician.",/z1YM3WFZnF2NwHT5IRGYUcvZBSl.jpg,Drama|Romance,0.7989
44,9312.0,"For nine generations an evil sorcerer has been victorious in hand-to-hand battle against his mortal enemies. If he wins a tenth Mortal Kombat tournament, desolation and evil will reign over the multiverse forever. To save Earth, three warriors must overcome seemingly insurmountable odds, their own inner demons, and superhuman foes.",/fcK7tzSSXMYiMN8E9KlZJL1BYyp.jpg,Action|Fantasy,3.5107
45,577.0,"Suzanne Stone wants to be a world-famous news anchor and she is willing to do anything to get what she wants. What she lacks in intelligence, she makes up for in cold determination and diabolical wiles. As she pursues her goal with relentless focus, she is forced to destroy anything and anyone that may stand in her way, regardless of the ultimate cost or means necessary.",/whz4bwvqE1OmQHIyqHdZD8jU9CO.jpg,Drama|Comedy|Crime,4.6355
46,11861.0,"Soon-to-be-wed graduate student Finn Dodd develops cold feet when she suspects her fiancé is cheating on her. In order to clear her head, Finn visits her grandmother, Hy, and great aunt, Glady Joe Cleary, in Grasse, Calif. There, Finn learns that Hy and Glady Joe are members of a group of passionate quilters, and over the course of her visit she is regaled with tales of love and life by women who have collected rich experiences and much wisdom.",/pI9UAemlWgdrnjRgYJsbTk8BSJc.jpg,Drama|Romance,2.9401
47,807.0,"Two homicide detectives are on a desperate hunt for a serial killer whose crimes are based on the ""seven deadly sins"" in this dark and haunting film that takes viewers from the tortured remains of one victim to the next. The seasoned Det. Somerset researches each sin in an effort to get inside the killer's mind, while his novice partner, Mills, scoffs at his efforts to unravel the case.",/191nKfP0ehp3uIvWqgPbFmI4lv9.jpg,Crime|Mystery|Thriller,13.3544
48,10530.0,"Pocahontas, daughter of a Native American tribe chief, falls in love with an English soldier as colonists invade 17th century Virginia.",/kZ1ft0QZ4e3zDUPMBftEkwI9ftd.jpg,Adventure|Animation|Family|Romance,9.1509
49,8391.0,"Camille is a professor at a Protestant college and is in a long-term relationship with Martin, a respected minister and fellow professor. When Camille meets Petra, a bold and flamboyant performer in a circus troupe, she is inexplicably drawn. Pursuing Petra, Camille throws her whole conservative life into disarray.",/6Ac5GLwJ01uli5mCXqXwquR36Y1.jpg,Drama|Romance,3.2022
50,629.0,"Held in an L.A. interrogation room, Verbal Kint attempts to convince the feds that a mythic crime lord, Keyser Soze, not only exists, but was also responsible for drawing him and his four partners into a multi-million dollar heist that ended with an explosion in San Pedro harbor – leaving few survivors. Verbal lures his interrogators with an incredible story of the crime lord's almost supernatural prowess.",/99X2SgyFunJFXGAYnDv3sb9pnUD.jpg,Drama|Crime|Thriller,9.3148
51,117164.0,"Detective-turned-bodyguard Cynthia McKay is hired by a psychotic, icy seductress, Nina Lindell, the same woman who killed McKay's lover months earlier.  With vendetta in her heart, McKay accompanies a flamboyantly playful womanizer through the glamorous world of the super-rich, as his protector.  In a unique role reversal, it is the woman protecting the man from another woman, erupting into a deadly triangle of passion, suspense and action.",/AoRBM85EbRY9U0jtgy88DtV99Jl.jpg,Action|Thriller|Drama,3.406
52,11448.0,"When Lenny and his wife, Amanda, adopt a baby, Lenny realizes that his son is a genius and becomes obsessed with finding the boy's biological mother in hopes that she will be brilliant too. But when he learns that Max's mother is Linda Ash, a kindhearted prostitute and porn star, Lenny is determined to reform her immoral lifestyle. A Greek chorus chimes in to relate the plot to Greek mythology in this quirky comedy.",/ice135yQZp4iX2SgCmd90nKgS5j.jpg,Comedy|Romance,6.0388
53,49133.0,"Fiore, an Italian conman, arrives in post Communist Albania with Gino, his young apprentice, to set up a shoe factory that will never open. The con requires a native Albanian, so they designate Spiro, an impoverished and confused former political prisoner as chairman of the board. When Fiore returns to Italy to get government funds for the project, Spiro unexpectedly disappears and Gino sets out on a journey to find him. The search leads him to discover Spiro's tragic personal history and witness Albanian poverty firsthand.",/nnLpA4mqb3gvhNJQZ00cOyBmeq3.jpg,Drama,8.2003
54,26441.0,"In a depressed Texas town, British foreign exchange teacher Anna attempts to inject some life into her hopeless kids by introducing them to soccer. They're terrible at first, but Anna and her football-hero assistant whip them into shape. As they work overtime, the pair help kids build their self-esteem and also get involved in solving family squabbles.",/nVHqIuBTcTLmAIrML7T704UwfNI.jpg,Family|Comedy,4.6287
55,97406.0,"Sadie looks up to her older sister Georgia, a successful folk singer. Unfortunately it is this very obsession — coupled with her self-destructive tendencies and rampant drug abuse — that keeps her spiraling down the drain.",/uXjfK404xo7SiVlFcAoRyaFqXR4.jpg,Drama,3.7363
56,124057.0,"Set in modern times, Alex finds King Arthur's sword Excalibur and must prove himself worthy of it.",/1y8KAZOKrdmTI2sddcilcbRsMtI.jpg,Family|Fantasy|Comedy|Adventure,2.4129
57,9089.0,"After losing her job, making out with her soon-to-be former boss, and finding out that her daughter plans to spend Thanksgiving with her boyfriend, Claudia Larson faces spending the holiday with her unhinged family.",/3zqlKdOttWyExzopVxglz50Vjxq.jpg,Comedy|Drama|Romance,4.6412
58,11010.0,Simple Italian postman learns to love poetry while delivering mail to a famous poet; he uses this to woo local beauty Beatrice.,/cUaCpjVDefYShKyLmkcDsiPaBHn.jpg,Comedy|Drama|Romance,1.62
59,99040.0,"Pierre Lamontagne has returned to Quebec to attend his father's funeral. He meets up with his adopted brother, Marc, who has begun questioning his identity and has embarked on a quest for his roots that would lead them to the Quebec of the 1950s. Past and present converge in a complex web of intrigue where the answer to the mystery lies.",/9ApR0PwQdlnvc76NmlbUWkeAK9i.jpg,Thriller|Drama|Mystery,2.0599
60,11359.0,A nine-year-old boy gets a plastic Indian and a cupboard for his birthday and finds himself involved in adventure when the Indian comes to life and befriends him.,/ozQAmW85tTJu2dhRe3evzyY03Nb.jpg,Adventure|Family|Fantasy,6.6142
61,17182.0,"It's fire and brimstone time as grieving mother Karen McCann takes justice into her own hands when a kangaroo court in Los Angeles fails to convict Robert Doob, the monster who raped and murdered her 17-year-old daughter.",/y2lZSdJ1o0VvLegTw3ad6KFtxra.jpg,Thriller|Drama,3.6351
62,2054.0,"In 1965, passionate musician Glenn Holland takes a day job as a high school music teacher, convinced it's just a small obstacle on the road to his true calling: writing a historic opus. As the decades roll by with the composition unwritten but generations of students inspired through his teaching, Holland must redefine his life's purpose.",/kBmwWeSN3ajnYHZ3dSybEobxEPI.jpg,Drama|Music,4.1056
63,10607.0,"When Ashtray moves to South Central L.A. to live with his father (who appears to be the same age he is) and grandmother (who likes to talk tough and smoke reefer), he falls in with his gang-banging cousin Loc Dog, who along with the requisite pistols and Uzi carries a thermo-nuclear warhead for self-defense. Will Ashtray be able to keep living the straight life?",/HZQBF7JDd2e9p4rPSbSHuWHaCC.jpg,Comedy|Crime,5.7533
64,19760.0,"Frank O'Brien, a petty thief, and his 7-year-long girlfriend Roz want to put an end to their unsteady lifestyle and just do that last job, which involves stealing a valuable painting. Frank takes Roz to an island on the coast of New England, where he wants to sell the painting and also hopes that their sagging relationship will get a positive push back up. Not everything goes as planned.",/xSfqAMYqrTtDeAjPtYo0S8nc5Zz.jpg,Comedy|Romance,2.9062
65,9536.0,"Moronic best friends get themselves locked inside the Bio-Dome, a science experiment, along with a group of environmental scientists for one year.",/pjSkGZAvksrbO6tGain8PJ3rfC7.jpg,Comedy,4.3684
66,11525.0,"After being rescued from the ruins of Virtual Space Industries, Jobe is rebuilt and reconnected to virtual reality by corporate mogul Jonathan Walker. Years later, teenage hacker Peter Parkette helps Jobe locate Benjamin Trace, the original creator of virtual reality, only to uncover Jobe’s plan to launch a new world order using Walker’s tech. Now, Peter, Trace, Cori, and a band of runaways must stop Jobe and Walker before they enslave humanity through cyberspace.",/aP8eGsCyZVCHgSMxhDa4KiC7H9B.jpg,Science Fiction|Horror|Action|Thriller,1.7169
